{
  "schemaVersion": 1,
  "contractId": "nll/season26-classic-live-preflight/v1",
  "assessmentUid": "3b200000-0000-4000-8000-000000000001",
  "assessedAtUtc": "2026-08-21T00:00:00Z",
  "verdict": "blocked_preflight_incomplete",
  "target": {
    "clientBuildVersion": "150.6.9",
    "seasonNumber": 26,
    "modeCode": "classic_solo_raid_challenge",
    "wireModeCode": "trial",
    "challengeRaidLevel": 8,
    "museumAllowed": false,
    "fallbackPolicyCode": "none"
  },
  "externalLineage": {
    "repositoryCode": "epinelps_epinelps",
    "licenseCode": "agpl-3.0-only",
    "sourceBoundaryCode": "external_agpl_checkout",
    "upstreamBaseCommitSha": "28b2f5413a0a1e3521a11ae162f91851335c8b40",
    "selectedManagerIntegrationCommitSha": "92a6ca228aeb580988907b96189b2857dff2c62d",
    "preflightSealCommitSha": "e32e5f900775974d5736e7fb2b50f8c62638a004",
    "preflightHardeningCommitSha": "4f7bd5b5eb2b9a6e03af503f1c09adc4c4f7f16f",
    "latestExternalTreeCommitSha": "ce353eeebee3c76672e483c6f735bb27f0227815"
  },
  "environment": {
    "environmentKindCode": "unresolved",
    "snapshotStatusCode": "not_measured",
    "systemTrustIsolationStatusCode": "not_measured",
    "primaryInstallIntegrityStatusCode": "not_measured",
    "syntheticLocalAccountOnly": true,
    "officialAccountMaterialPresent": false,
    "clientExecutionStarted": false
  },
  "runtimeInputs": {
    "clientBuildStatusCode": "not_measured",
    "externalLineageStatusCode": "not_measured",
    "reviewedRuntimeInputStatusCode": "not_measured",
    "reviewedRuntimeInputExpectedMemberCount": 4,
    "reviewedRuntimeInputObservedMemberCount": 0,
    "canonicalManifest": null
  },
  "networkIsolation": {
    "processTreeScopeStatusCode": "not_measured",
    "loopbackBindStatusCode": "not_measured",
    "nonLoopbackEgressStatusCode": "not_measured",
    "coversIpv4": false,
    "coversIpv6": false,
    "coversDns": false,
    "coversTcp": false,
    "coversUdp": false,
    "canonicalManifest": null
  },
  "mutationRollback": {
    "statusCode": "not_prepared",
    "systemHostsStatusCode": "not_measured",
    "rootCaStatusCode": "not_measured",
    "clientCertificateBundleStatusCode": "not_measured",
    "nativeCompatibilityShimStatusCode": "not_measured",
    "canonicalManifest": null
  },
  "prohibitedMaterial": {
    "rawGameIdentifiersIncluded": false,
    "localPathsIncluded": false,
    "officialCredentialsIncluded": false,
    "officialSessionMaterialIncluded": false,
    "certificateMaterialIncluded": false,
    "privateKeysIncluded": false,
    "rawPayloadsIncluded": false,
    "decodedRowsIncluded": false,
    "originalAssetsIncluded": false,
    "patchedBinaryBytesIncluded": false,
    "wireCapturesIncluded": false
  },
  "measuredEvidence": {
    "statusCode": "not_measured",
    "observationCount": 0,
    "canonicalManifest": null
  },
  "remainingBoundary": {
    "referenceRunExecuted": false,
    "originalClientBattleStarted": false,
    "originalClientResultVerified": false,
    "localLabShadowBridgeVerified": false,
    "phase3cVerified": false,
    "phase3dVerified": false,
    "phase4Verified": false,
    "nextPhaseCode": "phase3b2_isolated_season26_reference_run"
  },
  "blockingReasonCodes": [
    "disposable_environment_measurement_missing",
    "runtime_input_seal_missing",
    "network_isolation_measurement_missing",
    "rollback_manifest_missing"
  ],
  "nextStepRequirementCodes": [
    "source_free_preflight_measurement_required",
    "do_not_start_client"
  ]
}
